{
  "rooms": [
    {
      "id": "room_1",
      "walls": [
        { "from": [0, 0], "to": [5.0, 0], "height": 2.6 },
        { "from": [5.0, 0], "to": [5.0, 4.0], "height": 2.6 },
        { "from": [5.0, 4.0], "to": [0, 4.0], "height": 2.6 },
        { "from": [0, 4.0], "to": [0, 0], "height": 2.6 }
      ],
      "openings": [
        { "type": "door", "wall": 3, "offset": 0.4, "width": 0.9 },
        { "type": "window", "wall": 0, "offset": 1.8, "width": 1.4 }
      ]
    }
  ],
  "keyframes": [
    { "t": 4.0, "position": { "x": 0.6, "y": 1.6, "z": 3.4 }, "look_at": { "x": 3.0, "y": 1.0, "z": 0.5 } },
    { "t": 42.0, "position": { "x": 2.5, "y": 1.6, "z": 3.6 }, "look_at": { "x": 2.5, "y": 1.0, "z": 0.0 } },
    { "t": 88.0, "position": { "x": 4.4, "y": 1.6, "z": 3.4 }, "look_at": { "x": 1.0, "y": 0.8, "z": 1.0 } }
  ],
  "items": [
    { "id": "item_001", "label": "gray 2-seat fabric loveseat", "anchor": { "x": 2.5, "y": 0.42, "z": 0.55 }, "size": { "w": 1.6, "h": 0.84, "d": 0.9 }, "seen_at": [38.0, 44.5], "confidence": 0.95, "status": "present" },
    { "id": "item_002", "label": "55\" OLED TV, wall-mounted", "anchor": { "x": 2.5, "y": 1.35, "z": 3.95 }, "size": { "w": 1.23, "h": 0.71, "d": 0.05 }, "seen_at": [12.0, 90.0], "confidence": 0.93, "status": "present" },
    { "id": "item_003", "label": "stand mixer, red", "anchor": { "x": 4.6, "y": 1.1, "z": 2.2 }, "size": { "w": 0.4, "h": 0.4, "d": 0.3 }, "seen_at": [61.5, 63.0], "confidence": 0.91, "status": "present" },
    { "id": "item_004", "label": "black metal arc floor lamp", "anchor": { "x": 1.3, "y": 0.9, "z": 0.4 }, "size": { "w": 0.4, "h": 1.8, "d": 0.4 }, "seen_at": [35.0], "confidence": 0.82, "status": "present" },
    { "id": "item_005", "label": "oak rectangular coffee table", "anchor": { "x": 2.5, "y": 0.22, "z": 1.7 }, "size": { "w": 1.1, "h": 0.44, "d": 0.6 }, "seen_at": [40.0, 47.0], "confidence": 0.9, "status": "present" },
    { "id": "item_006", "label": "white 5-shelf bookcase", "anchor": { "x": 0.2, "y": 0.9, "z": 2.4 }, "size": { "w": 0.3, "h": 1.8, "d": 0.8 }, "seen_at": [20.0, 24.0], "confidence": 0.88, "status": "present" },
    { "id": "item_007", "label": "13\" laptop, silver", "anchor": { "x": 2.3, "y": 0.46, "z": 1.65 }, "size": { "w": 0.3, "h": 0.02, "d": 0.21 }, "seen_at": [46.0], "confidence": 0.77, "status": "present" },
    { "id": "item_008", "label": "kitchen counter with base cabinets", "anchor": { "x": 4.7, "y": 0.45, "z": 2.4 }, "size": { "w": 0.6, "h": 0.9, "d": 2.2 }, "seen_at": [58.0, 66.0], "confidence": 0.94, "status": "present" },
    { "id": "item_009", "label": "espresso machine, stainless", "anchor": { "x": 4.65, "y": 1.08, "z": 3.0 }, "size": { "w": 0.3, "h": 0.36, "d": 0.35 }, "seen_at": [64.0], "confidence": 0.85, "status": "present" },
    { "id": "item_010", "label": "wool area rug, 5x8 ft, beige", "anchor": { "x": 2.5, "y": 0.005, "z": 1.5 }, "size": { "w": 2.44, "h": 0.01, "d": 1.52 }, "seen_at": [41.0], "confidence": 0.8, "status": "present" },
    { "id": "item_011", "label": "acoustic guitar on wall stand", "anchor": { "x": 0.45, "y": 0.5, "z": 3.6 }, "size": { "w": 0.4, "h": 1.0, "d": 0.3 }, "seen_at": [92.0], "confidence": 0.71, "status": "present" }
  ],
  "fidelity": {
    "ground_truth_count": 12,
    "single_pass": { "recall": 0.58, "precision": 0.85 },
    "after_loop": { "recall": 0.92, "precision": 0.96 },
    "iterations": 3
  }
}
